{"plan_version":1,"parent":"raw:4000x2000:equirectangular","parent_identity":"sha256:0000000000000000000000000000000000000000000000000000000000000001","width":4000,"height":2000,"strip":280,"left_span":[3720,4000],"right_span":[0,280],"identity":"sha256:00000000000000000000000000000000000000000000000000000000000000ab"}
